{
  "$schema": "http://json-schema.org/draft-07/schema#",
  "title": "Faktura",
  "description": "Faktura / Invoice",
  "type": "object",
  "required": ["invoice_number", "date", "due_date", "sender", "recipient", "lines"],
  "additionalProperties": false,
  "properties": {
    "page_template": {
      "$comment": "Generated at load time from the slot model in klartex/page_templates.py (page_template_schema); see registry.py."
    },
    "number_format": { "type": "string", "enum": ["sv", "en"], "description": "Number format for amounts: 'sv' gives 32 400,00 (default), 'en' gives 32,400.00." },
    "logo": { "type": "string", "description": "Image file (pdf/png) shown in the invoice body's top-left corner, aligned with the FAKTURA block, in place of the sender wordmark. A plain file name is looked up via the asset directory (the page template's directory) and cwd." },
    "logo_height": { "type": "string", "default": "1cm", "description": "Logo height as a LaTeX dimension, e.g. '1.5cm'." },
    "logo_offset": {
      "type": "object",
      "additionalProperties": false,
      "description": "Fine-tunes the logo position, as fractions of its height: positive x moves right (negative left), positive y moves up (negative down). E.g. {\"y\": 0.25} when the artwork has built-in padding. Starting point: left edge at the margin, top edge aligned with the FAKTURA heading.",
      "properties": {
        "x": { "type": "number", "default": 0 },
        "y": { "type": "number", "default": 0 }
      }
    },
    "footer": { "not": { "description": "`footer` is not a property of faktura. Company, contact and payment details go in the page template's footer slot: `page_template.footer` with variant `columns` and its `fields`." } },
    "invoice_number": { "type": "string" },
    "date": { "type": "string", "description": "Invoice date (YYYY-MM-DD)" },
    "due_date": { "type": "string", "description": "Due date (YYYY-MM-DD)" },
    "reference": { "type": "string", "description": "Customer reference / Er referens" },
    "our_reference": { "type": "string", "description": "Our reference / Vår referens" },
    "payment_terms": { "type": "string", "description": "e.g. 30 dagar netto" },
    "currency": { "type": "string", "default": "SEK" },
    "sender": {
      "type": "object",
      "required": ["name"],
      "additionalProperties": false,
      "description": "Sender/seller. Required — an invoice without a seller is not an invoice. Shown as its own block next to the recipient in the invoice body; the name is also the header wordmark when there is no logo, and the default footer's company, address and org number are derived from these fields.",
      "properties": {
        "name": { "type": "string", "pattern": "\\S", "description": "The company's legal name. At least one non-whitespace character — a blank name would render as a blank wordmark and a blank footer column." },
        "org_number": { "type": "string" },
        "address_line1": { "type": "string" },
        "address_line2": { "type": "string" }
      }
    },
    "recipient": {
      "type": "object",
      "required": ["name"],
      "additionalProperties": false,
      "properties": {
        "name": { "type": "string" },
        "org_number": { "type": "string" },
        "address_line1": { "type": "string" },
        "address_line2": { "type": "string" }
      }
    },
    "lines": {
      "type": "array",
      "items": {
        "type": "object",
        "required": ["description", "quantity", "unit_price"],
        "additionalProperties": false,
        "properties": {
          "description": { "type": "string" },
          "quantity": { "type": "number" },
          "unit": { "type": "string", "default": "st" },
          "unit_price": { "type": "number" },
          "vat_percent": { "type": "number", "default": 25 }
        }
      },
      "minItems": 1
    },
    "bankgiro": { "type": "string", "description": "Payment detail, rendered in the default footer's Betalning column. A `page_template.footer.fields.bankgiro` of its own wins. The in-body Betalningsinformation block is the fallback, rendered only when the resolved footer carries no payment detail — a custom footer source or whole-page source is not inspected, so a caller whose own source prints payment details omits these fields." },
    "plusgiro": { "type": "string", "description": "Fallback — se bankgiro." },
    "iban": { "type": "string", "description": "Fallback — se bankgiro." },
    "bic": { "type": "string", "description": "Fallback — se bankgiro." },
    "note": { "type": "string", "description": "Optional note shown below the invoice content." }
  }
}
