{
  "invoice_number": "2026-001",
  "date": "2026-02-15",
  "due_date": "2026-03-17",
  "reference": "Kalle Kund",
  "our_reference": "Anna Andersson",
  "payment_terms": "30 dagar netto",
  "currency": "SEK",
  "sender": {
    "name": "Konsultbolaget AB",
    "address_line1": "Verkstadsgatan 12",
    "address_line2": "211 32 Malmö"
  },
  "recipient": {
    "name": "Kundföretaget AB",
    "org_number": "556123-4567",
    "address_line1": "Storgatan 1",
    "address_line2": "123 45 Stockholm"
  },
  "lines": [
    {
      "description": "Konsulttjänster februari",
      "quantity": 40,
      "unit": "tim",
      "unit_price": 1200.00,
      "vat_percent": 25
    },
    {
      "description": "Reseersättning",
      "quantity": 1,
      "unit": "st",
      "unit_price": 2500.00,
      "vat_percent": 25
    }
  ],
  "bankgiro": "1234-5678",
  "iban": "SE12 3456 7890 1234 5678 9012",
  "bic": "ESSESESS",
  "note": "Tack för ert förtroende!"
}
